platform,set,component,tags,description,use1_title,use1_detect,use1_decide,use1_do,use1_image_url,use2_title,use2_detect,use2_decide,use2_do,use2_image_url,parts,component_image_url,code1_label,code1,code2_label,code2,code3_label,code3,note,wiring,wiring_image_url,quick_reference,github_url
"Raspberry Pi / Pico","Pete","Button","Detect, Press","A button lets your project notice when someone presses something.
Inside the button are tiny metal contacts. Pressing the cap joins the contacts together, closing the circuit.
Your projects can use a button to start actions, choose modes, confirm choices, or act like a simple controller.","Doorbell trigger","Button is pressed","Press is new","Play chime","https://github.com/raspberrypilearning/skills-bricks/blob/master/Button-Pete/images/doorbell-trigger.png","Pet rock applause","Applause button press","Rock needs praise","Play tiny applause","https://github.com/raspberrypilearning/skills-bricks/blob/master/Button-Pete/images/pet-rock-applause.png","Cap: Press here; Contacts: Close circuit; Legs: Four pins; Body: Sits on board","https://github.com/raspberrypilearning/skills-bricks/blob/master/Button-Pete/images/component-button.png","Raspberry Pi","from gpiozero import Button

button = Button(17)

pressed = button.is_pressed","Raspberry Pi Pico","from picozero import Button

button = Button(2)

pressed = button.is_pressed","","","Use button.is_pressed or button.when_pressed when your project needs to react to a press.","GPIO 17 -> one button leg | opposite leg -> GND | GP2 -> one button leg | opposite leg -> GND","","","https://github.com/raspberrypilearning/skills-bricks/blob/master/Button-Pete/button-skill-brick.html"
"Raspberry Pi / Pico","Pete","Buzzer","Do, Sound","A buzzer lets your project make a simple sound.
Some buzzers just turn on and off, while others can make different tones.
Your projects can use buzzers for alarms, timers, games, tiny celebrations, and noisy mistakes.","Countdown timer","Timer reaches zero","Time is up","Beep buzzer","https://github.com/raspberrypilearning/skills-bricks/blob/master/Buzzer-Pete/images/countdown-timer.png","Sock finder siren","Lost sock button pressed","Search mode begins","Buzz dramatically","https://github.com/raspberrypilearning/skills-bricks/blob/master/Buzzer-Pete/images/sock-finder-siren.png","+: Signal; -: Ground; Hole: Sound comes out; Case: Holds disc","https://github.com/raspberrypilearning/skills-bricks/blob/master/Buzzer-Pete/images/component-buzzer.png","Raspberry Pi","from gpiozero import Buzzer

buzzer = Buzzer(17)

buzzer.beep()","Raspberry Pi Pico","from picozero import Buzzer

buzzer = Buzzer(2)

buzzer.beep()","","","Use buzzer.on() , buzzer.off() , or buzzer.beep() after a Detect brick spots something.","+ pin -> GPIO 17 | - pin -> GND | + pin -> GP2 | - pin -> GND","","","https://github.com/raspberrypilearning/skills-bricks/blob/master/Buzzer-Pete/buzzer-skill-brick.html"
"Raspberry Pi / Pico","Pete","Capacitive Touch Sensor","Detect, Touch","A capacitive touch sensor lets your project detect a gentle finger touch.
It senses a tiny change in electricity around its touch pad, a bit like the screen on a phone or tablet.
Your projects can use touch to make hidden buttons, magic switches, musical pads, or secret controls.","Touch lamp switch","Finger touches pad","Lamp should change","Toggle light","https://github.com/raspberrypilearning/skills-bricks/blob/master/Capacitive_Touch-Pete/images/touch-lamp-switch.png","Secret banana piano","Banana key touched","Banana note chosen","Play squeaky tune","https://github.com/raspberrypilearning/skills-bricks/blob/master/Capacitive_Touch-Pete/images/secret-banana-piano.png","Pad: Touch area; OUT: Touch signal; VCC: Power; GND: Ground","https://github.com/raspberrypilearning/skills-bricks/blob/master/Capacitive_Touch-Pete/images/component-capacitive-touch.svg","Raspberry Pi","from gpiozero import DigitalInputDevice

touch = DigitalInputDevice(
    17,
    pull_up=False
)

touched = touch.is_active","Raspberry Pi Pico","from picozero import TouchSensor

touch = TouchSensor(2)

touched = touch.is_touched","","","Use touch.is_active on Raspberry Pi or touch.is_touched on Pico when your project needs to react to touch.","VCC -> 3V3 | GND -> GND | OUT -> GPIO 17 | VCC -> 3V3 | GND -> GND | OUT -> GP2","","","https://github.com/raspberrypilearning/skills-bricks/blob/master/Capacitive_Touch-Pete/capacitive-touch-skill-brick.html"
"Raspberry Pi / Pico","Pete","LDR","Detect, Light","An LDR helps your project notice light and dark.
LDR stands for light-dependent resistor. Its reading changes when more or less light hits it.
Your projects can use an LDR to react to shadows, lamps, daylight, or secret hand waves.","Night light","Room gets dark","Light level is low","Turn lamp on","https://github.com/raspberrypilearning/skills-bricks/blob/master/LDR-Pete/images/night-light.png","Shadow snack machine","Hand shadow appears","Shadow trap triggered","Make crunch sound","https://github.com/raspberrypilearning/skills-bricks/blob/master/LDR-Pete/images/shadow-snack-machine.png","Face: Detects light; Track: Changes resistance; Leg 1: No polarity; Leg 2: No polarity","https://github.com/raspberrypilearning/skills-bricks/blob/master/LDR-Pete/images/component-ldr.png","Raspberry Pi","from gpiozero import LightSensor

ldr = LightSensor(17)

light = ldr.light_detected","Raspberry Pi Pico","from machine import ADC

ldr = ADC(26)

light_level = ldr.read_u16()","","","Use light or light_level when your project needs to react to light.","LDR and capacitor/resistor circuit -> GPIO 17 | other side -> 3V3/GND as drawn | Voltage divider signal -> ADC GP26 | ends -> 3V3 and GND","","","https://github.com/raspberrypilearning/skills-bricks/blob/master/LDR-Pete/ldr-skill-brick.html"
"Raspberry Pi / Pico","MrC","LDR","Detect, Level","An LDR is a light sensor that tells your project how bright or dark it is.
LDR stands for light dependent resistor. Its resistance changes when more or less light falls on the sensor face.
Your projects can use an LDR to react to sunshine, shadows, daylight, or darkness.","Automatic night light","Room light level","Room is dark","Turn on lamp","https://github.com/raspberrypilearning/skills-bricks/blob/master/LDR/automatic-night-light.png","Greenhouse grow light","Plant light level","Plants are too shaded","Turn on grow light","https://github.com/raspberrypilearning/skills-bricks/blob/master/LDR/greenhouse-grow-light.png","Sensor face: Detects light; Track: Changes resistance; Legs: Connect to circuit","https://github.com/raspberrypilearning/skills-bricks/blob/master/LDR/ldr.png","Raspberry Pi","from gpiozero import LightSensor

ldr = LightSensor(18)

brightness = ldr.value","Raspberry Pi Pico","from machine import ADC, Pin

ldr = ADC(Pin(26))

brightness = ldr.read_u16()","","","Use brightness later in your Decide code to react to light or darkness. On Raspberry Pi, LightSensor uses an LDR and a capacitor. On Pico, use the LDR in a voltage divider with a fixed resistor.","3V3 -> LDR -> GPIO 18 | GPIO 18 -> 1 uF capacitor -> GND | 3V3 -> LDR -> GP26 | GP26 -> 10k resistor -> GND","","","https://github.com/raspberrypilearning/skills-bricks/blob/master/LDR/ldr-skill-brick.html"
"Raspberry Pi / Pico","Pete","LED","Do, Light","An LED is a tiny light that your code can switch on, switch off, or blink.
LED stands for light-emitting diode. It glows when electricity flows the right way through it, so the long leg and short leg matter.
Your projects can use LEDs to show warnings, celebrate events, or tell people what is happening.","Mini traffic light","Timer reaches stop point","Cars must stop now","Turn on red LED","https://github.com/raspberrypilearning/skills-bricks/blob/master/LED-Pete/images/mini-traffic-light.png","Do not turn me off box","Light is off","Random wait is over","Turn LED back on","https://github.com/raspberrypilearning/skills-bricks/blob/master/LED-Pete/images/do-not-turn-me-off-box.png","Anode: Long leg; Cathode: Short leg; Lens: Glows here","https://github.com/raspberrypilearning/skills-bricks/blob/master/LED-Pete/images/component-led.png","Raspberry Pi","from gpiozero import LED

led = LED(17)

led.on()","Raspberry Pi Pico","from picozero import LED

led = LED(2)

led.on()","","","Use led.on() , led.off() , or led.blink() after a Detect brick spots something.","GPIO 17 -> resistor -> LED anode | LED cathode -> GND | GP2 -> resistor -> LED anode | LED cathode -> GND","","","https://github.com/raspberrypilearning/skills-bricks/blob/master/LED-Pete/led-skill-brick.html"
"Raspberry Pi / Pico","MrC","LED","Do, Light","An LED is a tiny light that your code can switch on, switch off, or blink.
LED stands for light-emitting diode. It glows when electricity flows the right way through it, so the long leg and short leg matter.
Your projects can use LEDs to show warnings, celebrate events, or tell people what is happening.","Mini traffic light","Timer reaches stop point","Cars must stop now","Turn on red LED","","Motion sensor light","Movement near the sensor","Someone has arrived","Turn on the LED","","Anode: Long leg; Cathode: Short leg; Lens: Glows here","https://github.com/raspberrypilearning/skills-bricks/blob/master/LED/component-led.png","Raspberry Pi","from gpiozero import LED

led = LED(17)

led.on()","Raspberry Pi Pico","from picozero import LED

led = LED(2)

led.on()","","","Use led.on() , led.off() , or led.blink() later in your Do code.","GPIO 17 -> resistor -> LED anode | LED cathode -> GND | GP2 -> resistor -> LED anode | LED cathode -> GND","","","https://github.com/raspberrypilearning/skills-bricks/blob/master/LED/led-skill-brick.html"
"Raspberry Pi / Pico","Pete","Line Sensor","Detect, Line","A line sensor helps your project notice dark and light marks underneath it.
It shines infrared light down and checks how much bounces back from the surface.
Your projects can use line sensors for robots, edge finding, counters, and secret floor maps.","Line-following robot","Sensor sees line","Line is under robot","Steer robot","https://github.com/raspberrypilearning/skills-bricks/blob/master/Line_Sensor-Pete/images/line-following-robot.png","Secret floor rune","Dark mark appears","Mark has been found","Unlock secret route","https://github.com/raspberrypilearning/skills-bricks/blob/master/Line_Sensor-Pete/images/secret-floor-rune.png","Emitter: Sends IR; Receiver: Reads reflection; OUT: Signal pin; VCC/GND: Power pins","https://github.com/raspberrypilearning/skills-bricks/blob/master/Line_Sensor-Pete/images/component-line-sensor.svg","Raspberry Pi","from gpiozero import LineSensor

sensor = LineSensor(17)

line_value = sensor.value","Raspberry Pi Pico","from picozero import DigitalInputDevice

sensor = DigitalInputDevice(2)

line_seen = sensor.is_active","","","Use line_value or line_seen when your project needs to react to a line.","VCC -> 3V3 | OUT -> GPIO 17 | GND -> GND | VCC -> 3V3 | OUT -> GP2 | GND -> GND","","","https://github.com/raspberrypilearning/skills-bricks/blob/master/Line_Sensor-Pete/line-sensor-skill-brick.html"
"Raspberry Pi / Pico","Pete","Motor/Driver","Do, Move","A motor driver lets your code safely control a motor.
The driver handles the bigger motor power, while the computer sends small control signals.
Your projects can use motors to move wheels, fans, arms, signs, and tiny machines.","Robot wheel","Go command received","Path is clear","Drive motor forward","https://github.com/raspberrypilearning/skills-bricks/blob/master/Motor_Driver-Pete/images/robot-wheel.png","Tiny flag waver","Celebration starts","Victory is official","Wave flag wildly","https://github.com/raspberrypilearning/skills-bricks/blob/master/Motor_Driver-Pete/images/tiny-flag-waver.png","Control: Signal pins; Motor: Terminals; Power: Motor supply; Driver: Switches current","https://github.com/raspberrypilearning/skills-bricks/blob/master/Motor_Driver-Pete/images/component-motor-driver.png","Raspberry Pi","from gpiozero import Motor

motor = Motor(forward=17, backward=18)

motor.forward()","Raspberry Pi Pico","from picozero import Motor

motor = Motor(forward=2, backward=3)

motor.forward()","","","Use motor.forward() , motor.backward() , or motor.stop() after a Detect brick spots something.","IN1 -> GPIO 17 | IN2 -> GPIO 18 | motor power -> driver VM/GND | IN1 -> GP2 | IN2 -> GP3 | motor power -> driver VM/GND","","","https://github.com/raspberrypilearning/skills-bricks/blob/master/Motor_Driver-Pete/motor-driver-skill-brick.html"
"Raspberry Pi / Pico","Pete","NeoPixels","Do, Pixels","NeoPixels are colourful lights that can be controlled one by one from a single data wire.
Each pixel remembers its own colour, so a strip can become a sign, meter, clock, or rainbow trail.
Your projects can use NeoPixels for badges, reactions, animations, and unnecessary sparkle.","Progress bar","Task gets further","Progress level increased","Light more pixels","https://github.com/raspberrypilearning/skills-bricks/blob/master/NeoPixels-Pete/images/progress-bar.png","Disco shoelace meter","Magic level changes","Shoelace needs sparkle","Run rainbow wave","https://github.com/raspberrypilearning/skills-bricks/blob/master/NeoPixels-Pete/images/disco-shoelace-meter.png","DIN: Data in; 5V: Power; GND: Ground; Pixel: RGB LED","https://github.com/raspberrypilearning/skills-bricks/blob/master/NeoPixels-Pete/images/component-neopixel.png","Raspberry Pi","from rpi_ws281x import PixelStrip, Color

pixels = PixelStrip(8, 18)
pixels.begin()

pixels.setPixelColor(0, Color(255, 0, 80))
pixels.show()","Raspberry Pi Pico","from machine import Pin
from neopixel import NeoPixel

pixels = NeoPixel(Pin(2), 8)

pixels[0] = (255, 0, 80)
pixels.write()","","","Use pixels.setPixelColor() and pixels.show() on Raspberry Pi, or pixels[0] and pixels.write() on Pico.","DIN -> GPIO 18 | 5V -> external 5V | GND -> shared GND | DIN -> GP2 | VCC -> 3V3 or 5V strip supply | GND -> shared GND","","","https://github.com/raspberrypilearning/skills-bricks/blob/master/NeoPixels-Pete/neopixels-skill-brick.html"
"Raspberry Pi / Pico","Pete","PIR","Detect, Motion","A PIR sensor helps your project notice movement from people or warm things nearby.
PIR stands for passive infrared. It watches for changes in heat moving across its view.
Your projects can use PIR sensors for lights, alarms, counters, and dramatic entrances.","Room light","Someone walks in","Room is occupied","Turn light on","https://github.com/raspberrypilearning/skills-bricks/blob/master/PIR-Pete/images/room-light.png","Sneaky snack guard","Hand approaches biscuits","Snack raid detected","Sound alarm","https://github.com/raspberrypilearning/skills-bricks/blob/master/PIR-Pete/images/sneaky-snack-guard.png","VCC: Power; OUT: Motion signal; GND: Ground; Lens: Wide view","https://github.com/raspberrypilearning/skills-bricks/blob/master/PIR-Pete/images/component-pir.png","Raspberry Pi","from gpiozero import MotionSensor

pir = MotionSensor(17)

motion = pir.motion_detected","Raspberry Pi Pico","from picozero import MotionSensor

pir = MotionSensor(2)

motion = pir.motion_detected","","","Use motion when your project needs to react to movement.","VCC -> 5V | OUT -> GPIO 17 | GND -> GND | VCC -> 3V3 or 5V module supply | OUT -> GP2 | GND -> GND","","","https://github.com/raspberrypilearning/skills-bricks/blob/master/PIR-Pete/pir-skill-brick.html"
"Raspberry Pi / Pico","MrC","PIR Sensor","Detect, Motion","A PIR sensor tells your project when something warm moves nearby.
PIR stands for passive infrared. It detects changes in infrared energy, so it is very good at noticing people moving through its view.
Your projects can use a PIR sensor for automatic lights, security alarms, or movement-triggered actions.","Automatic hallway light","Person moving past sensor","Someone has arrived","Turn on light","https://github.com/raspberrypilearning/skills-bricks/blob/master/PIR/hallway-light.png","Security alarm","Movement in protected room","Alarm should trigger","Sound warning","https://github.com/raspberrypilearning/skills-bricks/blob/master/PIR/security-alarm.png","Dome: Senses movement; Pins: VCC OUT GND; Adjusters: Time and range","https://github.com/raspberrypilearning/skills-bricks/blob/master/PIR/pir-module.png","Raspberry Pi","from gpiozero import MotionSensor

pir = MotionSensor(4)

motion = pir.motion_detected","Raspberry Pi Pico","from machine import Pin

pir = Pin(2, Pin.IN)

motion = pir.value()","","","Use motion later in your Decide code to react when someone moves. Many PIR modules need a short warm-up time after power is connected before their readings settle.","5V -> VCC | GPIO 4 GND | 5V -> VCC | GP2 GND","","","https://github.com/raspberrypilearning/skills-bricks/blob/master/PIR/pir-skill-brick.html"
"Raspberry Pi / Pico","MrC","Piezo Buzzer","Do, Sound","A piezo buzzer is a small part that makes a buzz or beep when your code turns it on.
It changes electrical energy into vibration, which creates a sound you can hear without needing a screen or lights.
Your projects can use a buzzer for alarms, countdowns, warnings, or fun sound effects.","Sound alert","Program needs to alert","User must hear it now","Beep the buzzer","https://github.com/raspberrypilearning/skills-bricks/blob/master/Piezo_Buzzer/buzzer_sound.png","Safety warning alarm","Unsafe machine state","People must stay back","Sound the buzzer","https://github.com/raspberrypilearning/skills-bricks/blob/master/Piezo_Buzzer/buzzerimage2.png","Positive: Signal side; Negative: Ground side; Sound hole: Lets sound out","https://github.com/raspberrypilearning/skills-bricks/blob/master/Piezo_Buzzer/buzzer.png","Raspberry Pi","from gpiozero import Buzzer

buzzer = Buzzer(17)

buzzer.on()","Raspberry Pi Pico","from picozero import Buzzer

buzzer = Buzzer(2)

buzzer.on()","","","Use an active buzzer for the simplest setup. Try buzzer.on() , buzzer.off() , or buzzer.beep() later in your Do code.","GPIO 17 -> buzzer positive | buzzer negative -> GND | GP2 -> buzzer positive | buzzer negative -> GND","","","https://github.com/raspberrypilearning/skills-bricks/blob/master/Piezo_Buzzer/piezo-buzzer-skill-brick.html"
"Raspberry Pi / Pico","Pete","Potentiometer","Detect, Turn","A potentiometer is a knob your project can read.
Turning the shaft changes the voltage on the middle pin, giving your code a value from low to high.
Your projects can use a potentiometer for volume, speed, brightness, choices, and silly dials.","Volume knob","Knob is turned","New level chosen","Set volume","https://github.com/raspberrypilearning/skills-bricks/blob/master/Potentiometer-Pete/images/volume-knob.png","Ridiculousness dial","Dial turns upward","Dial is silly enough","Add more sparkle","https://github.com/raspberrypilearning/skills-bricks/blob/master/Potentiometer-Pete/images/ridiculousness-dial.png","End pin: One side; Wiper: Middle pin; End pin: Other side; Shaft: Turn here","https://github.com/raspberrypilearning/skills-bricks/blob/master/Potentiometer-Pete/images/component-potentiometer.svg","Raspberry Pi","from gpiozero import MCP3008

pot = MCP3008(channel=0)

level = pot.value","Raspberry Pi Pico","from picozero import Potentiometer

pot = Potentiometer(26)

level = pot.value","","","Use level when your project needs to react to the knob.","SIG -> ADC channel 0 | outer pins -> 3V3 and GND | SIG -> ADC GP26 | outer pins -> 3V3 and GND","","","https://github.com/raspberrypilearning/skills-bricks/blob/master/Potentiometer-Pete/potentiometer-skill-brick.html"
"Raspberry Pi / Pico","Pete","RGB LED","Do, Colour","An RGB LED combines red, green, and blue lights in one part.
By changing the brightness of each colour, your code can mix lots of different colours.
Your projects can use RGB LEDs for moods, warnings, game states, and small light shows.","Status light","Project mode changes","Mode has a colour","Show colour","https://github.com/raspberrypilearning/skills-bricks/blob/master/RGB_LED-Pete/images/status-light.png","Mood crystal","Button is pressed","Mystery mood chosen","Glow weirdly","https://github.com/raspberrypilearning/skills-bricks/blob/master/RGB_LED-Pete/images/mood-crystal.png","Red: Red pin; Green: Green pin; Blue: Blue pin; Common: GND or 3V3","https://github.com/raspberrypilearning/skills-bricks/blob/master/RGB_LED-Pete/images/component-rgb-led.svg","Raspberry Pi","from gpiozero import RGBLED

led = RGBLED(red=17, green=27, blue=22)

led.color = (1, 0, 1)","Raspberry Pi Pico","from picozero import RGBLED

led = RGBLED(red=2, green=3, blue=4)

led.color = (1, 0, 1)","","","Use led.color after a Detect brick spots something.","Red -> GPIO 17 | Green -> GPIO 27 | Blue -> GPIO 22 | common -> GND | Red -> GP2 | Green -> GP3 | Blue -> GP4 | common -> GND","","","https://github.com/raspberrypilearning/skills-bricks/blob/master/RGB_LED-Pete/rgb-led-skill-brick.html"
"Raspberry Pi / Pico","Pete (example)","Ultrasonic Distance Sensor","Detect, Level","A distance sensor measures how far away something is without touching it.
It works a bit like a bat, sending out sounds and listening for the echo bouncing back to understand how far away things are.
Your projects can use the distance to react when something moves closer or further away.","Car reversing sensor","Car distance to wall","Wall is closer than 0.5 m","Turn on beeper","https://github.com/raspberrypilearning/skills-bricks/blob/master/Skills_Brick_Example-Pete/images/car-sensors.png","Magic treasure chest","Hand distance to chest","Hand is close enough","Light LED and open lid","https://github.com/raspberrypilearning/skills-bricks/blob/master/Skills_Brick_Example-Pete/images/magic-chest.png","VCC: Power; Trig: Sends pulse; Echo: Gets echo; GND: Ground","https://github.com/raspberrypilearning/skills-bricks/blob/master/Skills_Brick_Example-Pete/images/component-ultrasonic-distance-sensor.png","Raspberry Pi","from gpiozero import DistanceSensor

sensor = DistanceSensor(
    echo=18,
    trigger=17
)

distance = sensor.distance","Raspberry Pi Pico","from picozero import DistanceSensor

sensor = DistanceSensor(
    echo=3,
    trigger=2
)

distance = sensor.distance","","","Use distance when your project needs to react to nearby things.","Trigger: GPIO 17 Echo: GPIO 18 | Trigger: GP2 Echo: GP3","https://github.com/raspberrypilearning/skills-bricks/blob/master/Skills_Brick_Example-Pete/images/HC-SR04P-pi.png | https://github.com/raspberrypilearning/skills-bricks/blob/master/Skills_Brick_Example-Pete/images/HC-SR04P-pico.png","","https://github.com/raspberrypilearning/skills-bricks/blob/master/Skills_Brick_Example-Pete/ultrasonic-distance-sensor.html"
"Raspberry Pi / Pico","Pete","Speaker","Do, Sound","A speaker lets your project play tones and simple tunes.
Code changes the signal quickly to make the speaker vibrate at different pitches.
Your projects can use speakers for melodies, warnings, secret jingles, and dramatic noises.","Door chime","Door opens","Visitor arrived","Play tune","https://github.com/raspberrypilearning/skills-bricks/blob/master/Speaker-Pete/images/door-chime.png","Tiny fanfare machine","Excellent thing happens","Celebration required","Play fanfare","https://github.com/raspberrypilearning/skills-bricks/blob/master/Speaker-Pete/images/tiny-fanfare-machine.png","+: Signal; -: Ground; Cone: Vibrates; Magnet: Moves cone","https://github.com/raspberrypilearning/skills-bricks/blob/master/Speaker-Pete/images/component-speaker.png","Raspberry Pi","from gpiozero import TonalBuzzer
from gpiozero.tones import Tone

speaker = TonalBuzzer(17)

speaker.play(Tone('A4'))","Raspberry Pi Pico","from picozero import Speaker

speaker = Speaker(2)

speaker.play('E4', duration=1)","","","Use speaker.play() after a Detect brick spots something.","+ pin -> GPIO 17 | - pin -> GND | + pin -> GP2 | - pin -> GND","","","https://github.com/raspberrypilearning/skills-bricks/blob/master/Speaker-Pete/speaker-skill-brick.html"
"Raspberry Pi / Pico","Pete","Stepper","Do, Steps","A stepper motor moves in small controlled steps.
A driver board switches its coils in order, so code can choose direction and position more carefully.
Your projects can use steppers for dials, pointers, lifts, tiny plotters, and slow dramatic reveals.","Pointer dial","New value appears","Pointer must move","Step to angle","https://github.com/raspberrypilearning/skills-bricks/blob/master/Stepper-Pete/images/pointer-dial.png","Snack lift","Treat is requested","Treat can be lifted","Raise tiny elevator","https://github.com/raspberrypilearning/skills-bricks/blob/master/Stepper-Pete/images/snack-lift.png","Shaft: Turns in steps; Coils: Inside motor; Wires: To driver; Mounts: Screw holes","https://github.com/raspberrypilearning/skills-bricks/blob/master/Stepper-Pete/images/component-stepper.svg","Raspberry Pi","from gpiozero import OutputDevice

coils = [OutputDevice(pin) for pin in (17, 18, 27, 22)]

coils[0].on()","Raspberry Pi Pico","from picozero import Stepper

stepper = Stepper((2, 3, 4, 5))

stepper.step(100)","","","Use coils[0].on() on Raspberry Pi or stepper.step(100) on Pico after a Detect brick spots something.","IN1-IN4 -> GPIO 17, 18, 27, 22 | driver power -> motor supply and GND | IN1-IN4 -> GP2, GP3, GP4, GP5 | driver power -> motor supply and GND","","","https://github.com/raspberrypilearning/skills-bricks/blob/master/Stepper-Pete/stepper-skill-brick.html"
